Product Name,Rating,Customers_Rated,Price,Category
"Emerson SmartSet Alarm Clock Radio with AM/FM Radio, Dimmer, Sleep Timer and .9"" LED Display, CKS1900 (Black)",4.1 out of 5 stars,"11,087",$11.98,Electronics
"LandAirSea 54 GPS Tracker, - Waterproof Magnet Mount. Full Global Coverage. 4G LTE Real-Time Tracking for Vehicle, Asset, Fle",4.1 out of 5 stars,"17,816",$29.95,Electronics
"L5B83H Replacement Voice Remote Control (2nd GEN) fit for Amazon 2nd Gen Fire TV Stick, 2nd Gen Fire TV Cube, 1st Gen Fire TV",3.9 out of 5 stars,"1,361",$17.99,Electronics
Long Shadows (Memory Man Series),4.7 out of 5 stars,"10,287",$14.00,Books
"Fire TV Stick with Alexa Voice Remote (includes TV controls), HD streaming device",4.7 out of 5 stars,"315,338",$19.99,Electronics
Dancing Dinos Go to School (Step into Reading),4.8 out of 5 stars,"3,016",$3.99,Books
"Fire 7 Kids tablet, 7"" display, ages 3-7, with ad-free content kids love, 2-year worry-free guarantee, parental controls, 16 ",4.5 out of 5 stars,"1,105",$109.99,Electronics
Apple AirPods with Charging Case with AppleCare+ Bundle,4.9 out of 5 stars,"3,589",$118.99,Electronics
JBL Tune 230NC TWS True Wireless In-Ear Noise Cancelling Headphones - Black,4.3 out of 5 stars,"4,166",$69.95,Electronics
"Harry Potter and the Sorcerer's Stone: The Illustrated Edition (Harry Potter, Book 1)",4.9 out of 5 stars,"21,877",$21.99,Books
"The Wonder of Advent - Bible Study Book with Video Access: Delighting in the Hope, Joy, Peace, and Love of Christmas",4.9 out of 5 stars,Lifeway Women,$17.99,Books
How to Catch a Dinosaur,4.8 out of 5 stars,"12,227",$8.90,Books
Apple AirTag 4 Pack,4.8 out of 5 stars,"41,714",$109.99,Electronics
"Crest 3D Whitestrips, Vivid Plus, Teeth Whitening Strip Kit, 24 Count (Pack of 1)",4.5 out of 5 stars,"56,711",$29.99,Health and Household
"Apple Watch Series 7 (GPS, 45mm) Midnight Aluminum Case with Midnight Sport Band, Regular (Renewed)",4.5 out of 5 stars,"2,570",$309.99,Electronics
"How To Draw 101 Cute Stuff For Kids: Simple and Easy Step-by-Step Guide Book to Draw Everything like Animals, Gift, Avocado and more with Cute Style",4.7 out of 5 stars,641,$9.99,Books
"The Story Orchestra: The Nutcracker: Press the note to hear Tchaikovsky's music (Volume 2) (The Story Orchestra, 2)",4.8 out of 5 stars,Katy Flint,$22.49,Books
Hoseili【2022new editionBluetooth Headphones】.Bluetooth 5.0 Wireless Earphones in-Ear Stereo Sound Microphone Mini Wireless Ea,4.1 out of 5 stars,30,$17.98,Electronics
"The Boy, the Mole, the Fox and the Horse",4.8 out of 5 stars,"109,288",$10.35,Books
What Should Darla Do? Featuring the Power to Choose (The Power to Choose Series),4.8 out of 5 stars,"9,504",$9.98,Books
"Omega 3 Fish Oil 4,080mg - High EPA 1200mg + DHA 900mg Triple Strength Burpless Softgels - Arazo Nutrition (120 Soft Gels)",4.6 out of 5 stars,"26,071",$45.99,Health and Household
Lessons in Chemistry: A Novel,4.6 out of 5 stars,"55,093",$18.81,Books
"Amazon Smart Plug, for home automation, Works with Alexa - A Certified for Humans Device",4.7 out of 5 stars,"527,042",$24.99,Electronics
The Night Before Christmas Hardcover: The Classic Edition (The New York Times Bestseller),4.9 out of 5 stars,Clement Moore,$11.49,Books
"Reusable K Cups For Keurig, Reusable K CUP Coffee Filter Refillable Single K CUP for Keurig 2.0 1.0 BPA Free-6 Packs",4.4 out of 5 stars,"15,780",$8.99,Health and Household
"Command Cord Bundlers, Cord Organizer, 2-Bundlers Per Pack, Sold As 2 Packs (17304-ES)",4.7 out of 5 stars,"2,354",$13.99,Electronics
"JBL Tune 125TWS True Wireless In-Ear Headphones - JBL Pure Bass Sound, 32H Battery, Bluetooth, Fast Pair, Comfortable, Wirele",4.3 out of 5 stars,"28,420",$99.95,Electronics
"Philips One by Sonicare Rechargeable Toothbrush, Sage, HY1200/08",4.5 out of 5 stars,"19,390",$25.99,Health and Household
TIJN Blue Light Blocking Glasses for Women Men Clear Frame Square Nerd Eyeglasses Anti Blue Ray Computer Screen Glasses,4.4 out of 5 stars,"63,401",$9.99,Electronics
The Way I Used to Be,4.7 out of 5 stars,"3,985",$9.34,Books
"Nature's Bounty Fish Oil, Supports Heart Health, 1200 Mg, Rapid Release Softgels, 200 Ct",4.7 out of 5 stars,"56,719",$14.14,Health and Household
"Power Strip Surge Protector, 5Ft Extension Cord, 6 Outlets with 3 USB Ports(1 USB C Outlet), 3-Side Outlet Extender, Wall Mou",4.8 out of 5 stars,"1,131",$13.59,Electronics
"Colgate Total Teeth Whitening Toothpaste, 10 Benefits Including Sensitivity Relief and Whitening, 4.8 oz ( Pack of 4 )",4.7 out of 5 stars,"70,007",$13.34,Health and Household
Sensodyne Pronamel Gentle Whitening Enamel Toothpaste for Sensitive Teeth - 4 Ounces (Pack of 3),4.8 out of 5 stars,"40,314",$17.51,Health and Household
Paint by Sticker Kids: Christmas: Create 10 Pictures One Sticker at a Time! Includes Glitter Stickers,4.8 out of 5 stars,"6,225",$7.98,Books
"Gatorade Whey Protein Recover Bars, Chocolate Chip, 2.8 ounce bars (12 Count)",4.6 out of 5 stars,"18,088",$33.00,Health and Household
"Bluetooth Speaker with Lights, Wireless Charging Speaker, Dimmable Multi-Color Modern Night Lamp, Applicable for Bedroom/Teen",4.3 out of 5 stars,415,$39.99,Electronics
LUMIFY Redness Reliever Eye Drops 0.08 Ounce (2.5mL),4.6 out of 5 stars,"24,286",$14.99,Health and Household
"Fujifilm Fujicolor Superia X-TRA 400 Color Negative Film (35mm Roll Film, 36 Exposures, 3-Pack)",4.7 out of 5 stars,"2,516",$39.99,Electronics
XTEND Original BCAA Powder Watermelon Explosion - Sugar Free Post Workout Muscle Recovery Drink with Amino Acids - 7g BCAAs f,4.6 out of 5 stars,"46,602",$24.99,Health and Household
"Certified Refurbished Fire TV Stick with Alexa Voice Remote (includes TV controls), HD streaming device",4.2 out of 5 stars,51,$16.99,Electronics
"D-Line 6ft Floor Cord Cover, Floor Cable Protector, Extension Cord Cover, Protect Wires & Prevent Cable Trips, Cable Manageme",4.6 out of 5 stars,"12,120",$16.99,Electronics
"Beats Studio Buds - True Wireless Noise Cancelling Earbuds - Compatible with Apple & Android, Built-in Microphone, IPX4 Ratin",4.4 out of 5 stars,"47,080",$72.71,Electronics
"Wireless Earbuds, Bluetooth Earbuds Bluetooth 5.3 Headphones 36H Playtime LED Power Display Earbuds Stereo Sound Deep Bass Cr",4.4 out of 5 stars,"1,140",$29.99,Electronics
"Wireless Earbuds, yobola Bluetoth Earbuds, IPX5 Waterproof Wireless Headphones Touch Control, Bluetoth Headphones 5.1 Built-i",4.3 out of 5 stars,"16,167",$25.49,Electronics
The Return: Trump's Big 2024 Comeback,4.8 out of 5 stars,"1,836",$17.54,Books
"10 ft Extension Cord, Power Strip Surge Protector - 8 Widely AC Outlets 3 USB, Flat Plug, Desktop Charging Station with Overl",4.8 out of 5 stars,"2,480",$24.99,Electronics
"Blue Light Blocking Reading Glasses 4 Pack Computer Readers for Women Men,Anti Glare UV Ray Filter Eyeglasses +1.50",4.5 out of 5 stars,"3,713",$17.99,Electronics
"Wireless Earbuds, Bluetooth 5.3 Earbuds with 43H Playtime, IPX6 Waterproof Stereo Sound True Wireless Earbuds with Microphone",4.4 out of 5 stars,"2,321",$25.99,Electronics
"PreserVision AREDS 2 Eye Vitamin & Mineral Supplement, Contains Lutein, Vitamin C, Zeaxanthin, Zinc & Vitamin E, 120 Softgels",4.7 out of 5 stars,"44,431",$19.00,Health and Household
Man's Search for Meaning,4.7 out of 5 stars,"52,023",$7.49,Books
The Subtle Art of Not Giving a F*ck: A Counterintuitive Approach to Living a Good Life,4.6 out of 5 stars,"82,116",$13.99,Books
"Beats Studio Buds - True Wireless Noise Cancelling Earbuds - Compatible with Apple & Android, Built-in Microphone, IPX4 Ratin",4.4 out of 5 stars,"47,080",$71.96,Electronics
It Didn't Start with You: How Inherited Family Trauma Shapes Who We Are and How to End the Cycle,4.7 out of 5 stars,"8,039",$12.64,Books
"RORSOU R10 On-Ear Headphones with Microphone, Lightweight Folding Stereo Bass Headphones with 1.5M No-Tangle Cord, Portable W",4.5 out of 5 stars,"5,019",$16.99,Electronics
Diana: Her True Story--in Her Own Words,4.6 out of 5 stars,"8,574",$10.99,Books
MegaFood Blood Builder - Iron Supplement Shown to Increase Iron Levels without Nausea or Constipation - Energy Support with I,4.6 out of 5 stars,"23,407",$29.00,Health and Household
Mermaid Coloring Book: For Kids Ages 4-8 (US Edition) (Silly Bear Coloring Books),4.8 out of 5 stars,"3,490",$5.24,Books
101 Essays That Will Change The Way You Think,4.7 out of 5 stars,"10,346",$15.99,Books
"JBL Tune 125TWS True Wireless In-Ear Headphones - JBL Pure Bass Sound, 32H Battery, Bluetooth, Fast Pair, Comfortable, Wirele",4.3 out of 5 stars,"28,420",$47.45,Electronics
The Wise Men Who Found Christmas,4.8 out of 5 stars,191,$14.29,Books
"Echo (4th Gen) | Spherical design with rich sound, smart home hub, and Alexa | Charcoal",4.7 out of 5 stars,"131,432",$59.99,Electronics
"Gaoye 5-Pack Reading Glasses Blue Light Blocking,Spring Hinge Readers for Women Men Anti Glare Filter Lightweight Eyeglasses ",4.5 out of 5 stars,"74,157",$14.99,Health and Household
"Crest 3D White Luminous Mint Teeth Whitening Toothpaste, 3.7 oz, Pack of 4",4.8 out of 5 stars,"3,218",$14.99,Health and Household
"Hisense 55-Inch Class R6 Series Dolby Vision HDR 4K UHD Roku Smart TV with Alexa Compatibility (55R6G, 2021 Model)",4.5 out of 5 stars,"1,433",$448.99,Electronics
"Swiffer Dusters Surface Refills, Ceiling Fan Duster, Unscented, 18 Count",4.8 out of 5 stars,"35,622",$14.44,Health and Household
The No-Fuss Bread Machine Cookbook: Hands-Off Recipes for Perfect Homemade Bread,4.6 out of 5 stars,"11,878",$6.32,Books
"Duracell CR123A 3V Lithium Battery, 6 Count Pack, 123 3 Volt High Power Lithium Battery, Long-Lasting for Home Safety and Sec",4.7 out of 5 stars,"29,749",$30.29,Health and Household
"Duracell Coppertop AA Batteries with Power Boost Ingredients, 28 Count Pack Double A Battery with Long-lasting Power, Alkalin",4.8 out of 5 stars,"21,982",$20.99,Health and Household
"The 2023 Old Farmer's Almanac Trade Edition (Old Farmer's Almanac, 231)",4.8 out of 5 stars,"1,473",$7.96,Books
"Fire 7 tablet, 7” display, 16 GB, 10 hours battery life, light and portable for entertainment at home or on-the-go, (2022 rel",4.4 out of 5 stars,"3,810",$59.99,Electronics
"Belkin Power Strip Surge Protector - 12 AC Multiple Outlets & 8 ft Long Flat Plug Heavy Duty Extension Cord for Home, Office,",4.8 out of 5 stars,"48,436",$27.99,Electronics
"DUDE Wipes Flushable Wipes - 6 Pack, 288 Wipes - Unscented Wet Wipes with Vitamin-E & Aloe for at-Home Use - Septic and Sewer",4.8 out of 5 stars,"51,069",$15.36,Health and Household
"LET'S GO! Binocular for Kids, Compact High Resolution Shockproof Binoculars",4.4 out of 5 stars,"7,574",$17.99,Electronics
JBL Tune 230NC TWS True Wireless In-Ear Noise Cancelling Headphones - Blue,4.3 out of 5 stars,"4,166",$69.95,Electronics
"TCL 32"" Class 3-Series HD 720p LED Smart Roku TV - 32S355",4.4 out of 5 stars,60,$139.99,Electronics
"Stop Overthinking: 23 Techniques to Relieve Stress, Stop Negative Spirals, Declutter Your Mind, and Focus on the Present (The Path to Calm)",4.5 out of 5 stars,"5,521",$14.99,Books
"Ultima Hydrating Electrolyte Powder, Lemonade, 90 Servings, no Sugar, 0 Carbs or Calories, Keto, Gluten-Free, Paleo, Non-GMO,",4.8 out of 5 stars,"6,170",$41.99,Health and Household
"100% Compostable 9 Inch Paper Plates [125-Pack] Heavy-Duty Plate, Natural Disposable Bagasse Plate, Eco-Friendly Made of Suga",4.6 out of 5 stars,"35,884",$20.99,Health and Household
Amazon eero mesh WiFi system – router replacement for whole-home coverage (3-pack),4.5 out of 5 stars,"34,203",$169.00,Electronics
Oilway Blue-Light Blocking Glasses Computer Reading/Gaming/TV/Phones Glasses Fashion Anti Eyestrain UV Glasses for Women Men,4.6 out of 5 stars,589,$14.99,Electronics
"Probiotics for Women with Organic Prebiotics - 50 Billion CFU, D-Mannose & Cranberry Extract for Digestive, Immune & Feminine",4.5 out of 5 stars,"121,747",$23.99,Health and Household
"Listerine Total Care Anticavity Fluoride Mouthwash, 6 Benefits in 1 Oral Rinse Helps Kill 99% of Bad Breath Germs, Prevents C",4.8 out of 5 stars,"60,183",$7.49,Health and Household
"SAMSUNG 23.5” CF396 Curved Computer Monitor, AMD FreeSync for Advanced Gaming, 4ms Response Time, Wide Viewing Angle, Ultra S",4.7 out of 5 stars,"22,741",$119.99,Electronics
"Viva Naturals Sambucus Elderberry with Vitamin C, Zinc, Vitamin D3 5000 IU & Ginger (120 Capsules) - Antioxidant & Immune Sup",4.7 out of 5 stars,"40,442",$24.61,Health and Household
Atlas of the Heart: Mapping Meaningful Connection and the Language of Human Experience,4.8 out of 5 stars,"15,873",$17.78,Books
unknown-product,4.4 out of 5 stars,41,,Electronics
"Anourney 8x21 Mini Compact Pocket Binoculars, Lightweight Foldable Binoculars,Easy Focus Small Binoculars for Adults Kids Bir",4.3 out of 5 stars,366,$9.99,Electronics
Atomic Habits: An Easy & Proven Way to Build Good Habits & Break Bad Ones,4.8 out of 5 stars,"87,666",$11.98,Books
"Boka Ela Mint Natural Toothpaste, Nano-Hydroxyapatite for Remineralizing, Sensitivity and Whitening, Fluoride-Free, Dentist R",4.6 out of 5 stars,"14,260",$11.99,Health and Household
"Optimum Nutrition Amino Energy Plus Electrolytes Energy Drink Powder, Caffeine for Pre-Workout Energy, Amino Acids / BCAAs fo",4.6 out of 5 stars,"24,267",$26.99,Health and Household
You're My Little Cuddle Bug,4.9 out of 5 stars,Nicola Edwards,$4.33,Books
Shokz OpenRun Pro - Premium Bone Conduction Open-Ear Bluetooth Sport Headphones - Sweat Resistant Wireless Earphones for Work,4.6 out of 5 stars,"5,517",$172.75,Electronics
Amelia Bedelia Chapter Book 4-Book Box Set: Books 1-4,4.8 out of 5 stars,"6,753",$19.96,Books
Jeopardy! 2023 Day-to-Day Calendar,4.8 out of 5 stars,Sony,$15.29,Books
LiCB CR2032 3V Lithium Battery(10-Pack),4.6 out of 5 stars,"137,665",$3.99,Health and Household
"OxiClean White Revive Laundry Whitener Stain Remover, 5 Lbs",4.7 out of 5 stars,"33,289",$24.88,Health and Household
"BEAUTURAL Fabric Shaver and Lint Remover, Sweater Defuzzer with 2-Speeds, 2 Replaceable Stainless Steel Blades, Battery Opera",4.5 out of 5 stars,"82,653",$12.97,Health and Household
"Surge Protector Power Strip , Nuetsa Extension Cord with 8 Outlets and 4 USB Ports, 6 Feet Power Cord (1625W/13A) , 2700 Joul",4.8 out of 5 stars,"13,418",$17.97,Electronics
Fujifilm Instax Mini Mermaid Tail Film - 10 Exposures,4.8 out of 5 stars,"192,093",$7.98,Electronics
"Fitbit Versa 4 Fitness Smartwatch with Daily Readiness, GPS, 24/7 Heart Rate, 40+ Exercise Modes, Sleep Tracking and more, Bl",4.0 out of 5 stars,103,$149.95,Electronics
"Apple AirPods (2nd Generation) Wireless Earbuds with Lightning Charging Case Included. Over 24 Hours of Battery Life, Effortl",4.8 out of 5 stars,"546,686",$143.95,Electronics
Killing the Legends: The Lethal Danger of Celebrity,4.6 out of 5 stars,"1,433",$16.99,Books
"Universal Tv Remote for LG,Samsung, TCL, Philips, Vizio, Sharp, Sony, Panasonic, Sanyo, Insignia, Toshiba and Other Brands LC",4.2 out of 5 stars,344,$9.36,Electronics
"Amazon Basics 2-Ply Toilet Paper 5 Packs, 6 Rolls per pack (30 Rolls total) (Previously Solimo)",4.5 out of 5 stars,"111,795",$24.60,Health and Household
"Polaroid Color Film for I-Type Double Pack, 16 Photos (6009)",4.7 out of 5 stars,"13,444",$29.70,Electronics
TAGRY Bluetooth Headphones True Wireless Earbuds 60H Playback LED Power Display Earphones with Wireless Charging Case IPX5 Wa,4.5 out of 5 stars,"25,474",$34.99,Electronics
Apple iPad (2018 Model) with Wi-Fi only 32GB Apple 9.7in iPad - Space Gray (Renewed),4.6 out of 5 stars,"14,242",$159.00,Electronics
Skullcandy Crusher Evo Wireless Over-Ear Headphone - True Black,4.8 out of 5 stars,"9,284",$157.95,Electronics
"Pure Encapsulations Magnesium (Glycinate) | Supplement to Support Stress Relief, Sleep, Heart Health, Nerves, Muscles, and Me",4.7 out of 5 stars,"17,708",$15.00,Health and Household
"Chromecast with Google TV (HD) - Streaming Stick Entertainment on Your TV with Voice Search - Watch Movies, Shows, and Live T",4.7 out of 5 stars,"5,319",$29.40,Electronics
The Last Thing He Told Me: A Novel,4.3 out of 5 stars,"117,075",$13.07,Books
CHBP Blue-Light-Blocking-Glasses for Women Computer Glasses Man，2 Pack Gaming Eyeglasses Fashion Frame(black+transparent),4.4 out of 5 stars,"1,210",$5.38,Electronics
"Wireless Earbuds, Tribit 100H Playtime Bluetooth 5.0 IPX8 Waterproof Touch Control True Wireless Bluetooth Earbuds with Mic E",4.3 out of 5 stars,"24,125",$39.99,Electronics
"Drano Max Gel Drain Clog Remover and Cleaner for Shower or Sink Drains, Unclogs and Removes Hair, Soap Scum, Blockages, 80 oz",4.5 out of 5 stars,"29,622",$16.49,Health and Household
HEALSUN Blue Light Blocking Glasses for Women Men 4 PACK Computer Gaming Anti Headache Eye Strain,4.6 out of 5 stars,"1,290",$12.99,Electronics
Little Red Sleigh: A Heartwarming Christmas Book For Children,4.8 out of 5 stars,"2,574",$11.99,Books
The Very Hungry Caterpillar's Peekaboo Christmas (The World of Eric Carle),4.8 out of 5 stars,36,$8.98,Books
Amazon Basics 23A Alkaline Battery - Pack of 4,4.7 out of 5 stars,"20,162",$4.25,Health and Household
"Metamucil Sugar-Free Fiber Supplement, 180 Servings, 4-in-1 Psyllium Husk Powder, Orange Smooth Sugar Free, 36.8 Ounce, 2.3 P",4.7 out of 5 stars,"24,136",$29.48,Health and Household
"MZOO Sleep Eye Mask for Men Women, 3D Contoured Cup Sleeping Mask & Blindfold, Concave Molded Night Sleep Mask, Block Out Lig",4.7 out of 5 stars,"77,212",$19.99,Health and Household
Go-To Dinners: A Barefoot Contessa Cookbook,4.2 out of 5 stars,438,$22.26,Books
The Richest Man In Babylon - Original Edition,4.7 out of 5 stars,"9,389",$4.98,Books
"vitafusion Max Strength Melatonin Gummy Supplements, Strawberry Flavored Sleep Supplements for Adults, 100 Count",4.6 out of 5 stars,"70,271",$11.88,Health and Household
The Housemaid,4.5 out of 5 stars,"62,404",$9.98,Books
"Vital Proteins Collagen Peptides Powder, Promotes Hair, Nail, Skin, Bone and Joint Health, Unflavored 9.33 OZ",4.6 out of 5 stars,"210,508",$44.76,Health and Household
Where the Crawdads Sing,4.8 out of 5 stars,"362,157",$9.98,Books
My First Library : Boxset of 10 Board Books for Kids,4.6 out of 5 stars,"64,278",$16.79,Books
Pookie's Thanksgiving (Little Pookie),4.9 out of 5 stars,206,$6.99,Books
"KMC 6-Outlet Surge Protector Power Strip 2-Pack, 900 Joules, 4-Foot Extension Cord, Overload Protection, Black",4.8 out of 5 stars,"24,146",$19.99,Electronics
"Duracell Coppertop AA Batteries with Power Boost Ingredients, 20 Count Pack Double A Battery with Long-lasting Power, Alkalin",4.8 out of 5 stars,"43,194",$19.86,Health and Household
"Goli Ashwagandha & Vitamin D Gummy - 60 Count - Mixed Berry, KSM-66, Vegan, Plant Based, Non-GMO, Gluten-Free & Gelatin Free ",4.5 out of 5 stars,"37,450",$18.95,Health and Household
JLab Go Air True Wireless Bluetooth Earbuds + Charging Case | Green | Dual Connect | IP44 Sweat Resistance | Bluetooth 5.0 Co,4.2 out of 5 stars,"25,915",$14.99,Electronics
"Apple Watch Series 8 [GPS 45mm] Smart Watch w/ Midnight Aluminum Case with Midnight Sport Band - M/L. Fitness Tracker, Blood ",4.7 out of 5 stars,958,$363.84,Electronics
Elecder i37 Kids Headphones Children Girls Boys Teens Foldable Adjustable On Ear Headphones 3.5mm Jack Compatible Cellphones ,4.6 out of 5 stars,"24,910",$16.99,Electronics
The Beginner's Bible: Timeless Children's Stories,4.9 out of 5 stars,"21,512",$11.34,Books
"Collagen Peptides Powder - Hair, Skin, Nail, and Joint Support - Type I & III Grass-Fed Collagen Powder for Women and Men - N",4.5 out of 5 stars,"55,273",$48.99,Health and Household
"Copper Fit Health Unisex Arch Relief Plus with Built-In Orthotic Support, Black",4.0 out of 5 stars,"8,830",$14.88,Health and Household
The Far Side® 2023 Off-the-Wall Calendar,4.9 out of 5 stars,155,$15.29,Books
Good Inside: A Guide to Becoming the Parent You Want to Be,4.9 out of 5 stars,Dr. Becky Kennedy,$19.79,Books
"Hefty Ultra Strong Tall Kitchen Trash Bags, Clean Burst Scent, 13 Gallon, 80 Count",4.8 out of 5 stars,"27,557",$18.54,Health and Household
"Nature's Bounty Vitamin B12, Supports Energy Metabolism, Tablets, 1000mcg, 200 Ct",4.7 out of 5 stars,"51,795",$10.25,Health and Household
"Hario V60 Paper Coffee Filters Single Use Pour Over Cone Filters Size 02, Natural, 100 count",4.8 out of 5 stars,"33,184",$7.87,Health and Household
"Mindfulness Coloring Book For Adults: Zen Coloring Book For Mindful People | Adult Coloring Book With Stress Relieving Designs Animals, Mandalas, ... ADHD, Loss Of Anxiety, Relaxion, Meditation",4.6 out of 5 stars,YOURnotes Whimsical Relaxing Coloring Books,$5.99,Books
Corduroy,4.9 out of 5 stars,"16,431",$5.00,Books
"Amazon Basics 48 Pack AA High-Performance Alkaline Batteries, 10-Year Shelf Life, Easy to Open Value Pack",4.7 out of 5 stars,"495,418",$16.49,Health and Household
"Fujifilm Instax Mini Instant Film, 10 Sheets×5 Pack(Total 50 Shoots) [Bulk Packaging]",4.8 out of 5 stars,"10,077",$43.99,Electronics
"Good Night, Little Blue Truck",4.9 out of 5 stars,"14,745",$10.77,Books
"MiraLAX Laxative Powder for Gentle Constipation Relief, #1 Dr. Recommended Brand, 45 Dose Polyethylene Glycol 3350, Stimulant",4.8 out of 5 stars,"27,292",$42.00,Health and Household
"Bluetooth Headphones, Running Wireless Earbuds with 15 Hours Playtime, HD Deep Bass Stereo IPX7 Waterproof Earphones for Work",4.4 out of 5 stars,"3,254",$19.99,Electronics
The Light We Carry: Overcoming in Uncertain Times,3.8 out of 5 stars,20,$20.54,Books
"Super Interesting Facts For Smart Kids: 1272 Fun Facts About Science, Animals, Earth and Everything in Between",4.8 out of 5 stars,61,$11.90,Books
BulkSupplements.com Creatine Monohydrate Powder - Micronized Creatine - Creatine Powder - Creatine Supplements - Creatine Nut,4.6 out of 5 stars,"36,555",$28.96,Health and Household
"Amazon Basics 16-Gauge Speaker Wire Cable, 100 Feet",4.7 out of 5 stars,"48,504",$12.99,Electronics
"Listerine Cool Mint Pocketpaks Breath Strips Kills Bad Breath Germs, 24-Strip Pack, 3 Pack",4.8 out of 5 stars,"14,554",$4.99,Health and Household
BEEKEEPER'S NATURALS Propolis Throat Spray - 95% Bee Propolis Extract - Natural Immune Support & Sore Throat Relief - Antioxi,4.4 out of 5 stars,"9,209",$13.95,Health and Household
"Lysol Laundry Sanitizer Additive, Bacteria-Causing Laundry Odor Eliminator, 0% Bleach Laundry Sanitizer, color, , Multi 90 Fl",4.8 out of 5 stars,"80,706",$19.99,Health and Household
Wireless Earbuds Bluetooth Headphones 48hrs Play Back Sport Earphones with LED Display Over-Ear Buds with Earhooks Built-in M,4.5 out of 5 stars,"14,376",$39.99,Electronics
"Premier Protein Whey Powder, Chocolate, 24.5 Oz",4.4 out of 5 stars,"35,123",$28.00,Health and Household
NatureWise Curcumin Turmeric 2250mg (2 Month Supply) 95 Curcuminoids with BioPerine Black Pepper Extract Advanced Absorption ,4.6 out of 5 stars,"33,478",$14.99,Health and Household
"Affresh Dishwasher Cleaner, Helps Remove Limescale and Odor-Causing Residue, 6 Tablets",4.6 out of 5 stars,"69,970",$8.98,Health and Household
"Inspiring Stories for Amazing Boys: A Motivational Book about Courage, Confidence and Friendship",4.5 out of 5 stars,Emily Green,$11.90,Books
Dilbert 2023 Day-to-Day Calendar,4.9 out of 5 stars,64,$15.29,Books
"Goodnight, Goodnight Construction Site (Board Book for Toddlers, Children's Board Book)",4.9 out of 5 stars,"20,438",$4.28,Books
"(3 Pack) ONEBOM Firestick Remote Cover 3rd Gen with Alexa Voice Remote 4K/4K Max,Fire TV Stick Cover Glow in The Dark,Anti Sl",4.6 out of 5 stars,"1,948",$8.99,Electronics
"Bitvae Water Flosser Professional for Teeth , Portable 300ML Water Teeth Cleaner Picks , 3 Cleaning Modes 6 Jet Tips , IPX7 W",4.3 out of 5 stars,"2,375",$29.99,Health and Household
"Melissa & Doug Let's Play House Dust! Sweep! Mop! 6 Piece Pretend Play Set - Toddler Toy Cleaning Set, Pretend Home Cleaning ",4.8 out of 5 stars,"40,983",$25.00,Health and Household
"Wired Earbuds with Microphone, Kimwood Wired Earphones in-Ear Headphones HiFi Stereo, Powerful Bass and Crystal Clear Audio, ",4.4 out of 5 stars,"3,844",$12.99,Electronics
