Product Name,Rating,Customers_Rated,Price,Category
Balloons over Broadway: The True Story of the Puppeteer of Macy's Parade (Bank Street College of Education Flora Stieglitz Straus Award (Awards)),4.9 out of 5 stars,"1,525",$12.19,Books
"Half Baked Harvest Super Simple: More Than 125 Recipes for Instant, Overnight, Meal-Prepped, and Easy Comfort Foods: A Cookbook",4.8 out of 5 stars,"11,626",$18.27,Books
Turkey Trouble,4.8 out of 5 stars,"5,487",$7.84,Books
Bose QuietComfort 45 Bluetooth Wireless Noise Cancelling Headphones - Triple Black,4.7 out of 5 stars,"8,749",$329.00,Electronics
"Braiding Sweetgrass: Indigenous Wisdom, Scientific Knowledge and the Teachings of Plants",4.8 out of 5 stars,"14,351",$13.25,Books
"Roku Voice Remote (Official) for Roku Players, Roku TVs and Roku Audio",4.7 out of 5 stars,"53,371",$19.88,Electronics
"Tylenol Extra Strength Acetaminophen Rapid Release Gels, Pain Reliever & Fever Reducer, 100 ct",4.8 out of 5 stars,"47,659",$13.99,Health and Household
AKASO EK7000 4K30FPS Action Camera Ultra HD Underwater Camera 170 Degree Wide Angle 98FT Waterproof Camera,4.4 out of 5 stars,"31,835",$68.88,Electronics
"Friends, Lovers, and the Big Terrible Thing: A Memoir",4.4 out of 5 stars,"2,995",$14.00,Books
"Harry Potter and the Goblet of Fire: The Illustrated Edition (Harry Potter, Book 4) (Illustrated edition) (4)",4.9 out of 5 stars,"25,142",$21.52,Books
12 Rules for Life: An Antidote to Chaos,4.8 out of 5 stars,"60,966",$13.11,Books
"Amazon Basics 40W Equivalent, Soft White, Non-Dimmable, 10,000 Hour Lifetime, A19 LED Light Bulb | 6-Pack",4.7 out of 5 stars,"34,783",$11.78,Health and Household
"Quest Nutrition Cookies & Cream Protein Bars, High Protein, Low Carb, Gluten Free, Keto Friendly, 12 Count",4.4 out of 5 stars,"58,944",$29.95,Health and Household
NoseFrida Saline Spray by Frida Baby Saline Nasal Spray To Soften Nasal Passages For Use Before NoseFrida The SnotSucker (0.6,4.7 out of 5 stars,"12,932",$5.99,Health and Household
The Screaming Goat (Book & Figure),4.7 out of 5 stars,"30,587",$8.76,Books
"One Nation Under Blackmail: The Sordid Union Between Intelligence and Crime that Gave Rise to Jeffrey Epstein, VOL.1",4.6 out of 5 stars,Whitney Webb,$22.46,Books
I Love You to the Moon and Back,4.9 out of 5 stars,"61,435",$4.31,Books
"From Crook to Cook: Platinum Recipes from Tha Boss Dogg's Kitchen (Snoop Dogg Cookbook, Celebrity Cookbook with Soul Food Recipes) (Snoop Dog x Chronicle Books)",4.8 out of 5 stars,Snoop Dogg,$15.62,Books
"OHill Cable Clips,16 Pack Black Adhesive Cord Holders, Ideal Cable Cords Management for Organizing Cable Wires-Home, Office, ",4.5 out of 5 stars,"54,114",$7.99,Electronics
"Oral-B Pro 1000 CrossAction Electric Toothbrush, Black",4.7 out of 5 stars,"73,109",$39.97,Health and Household
"Nature Made Fish Oil 1000 mg, 250 Softgels Value Size, Fish Oil Omega 3 Supplement For Heart Health",4.8 out of 5 stars,"33,293",$17.99,Health and Household
The Boys from Biloxi: A Legal Thriller,4.4 out of 5 stars,"11,114",$14.00,Books
"Amazon Brand - Presto! 308-Sheet Mega Roll Toilet Paper, Ultra-Soft, 6 Count (Pack of 4), 24 Mega Rolls = 112 regular rolls",4.7 out of 5 stars,"127,364",$31.48,Health and Household
"Liquid I.V. Hydration Multiplier + Immune Support, Easy Open Packets, Fresh Tangerine Flavor | 14 Sticks",4.7 out of 5 stars,"18,475",$25.19,Health and Household
The Power of Now: A Guide to Spiritual Enlightenment,4.7 out of 5 stars,"43,664",$7.51,Books
"Scotties Everyday Comfort Facial Tissues, 92 Tissues per Box, 4 Pack, 92 Count (Pack of 4)",4.6 out of 5 stars,"9,563",$4.22,Health and Household
"Arm & Hammer Plus OxiClean Clean Meadow, 75 Loads Liquid Laundry Detergent, 118.1 Fl oz",4.8 out of 5 stars,"30,202",$8.49,Health and Household
The Return of the Gods,4.8 out of 5 stars,"2,477",$20.49,Books
Amazon Basics 3.5mm to 2-Male RCA Adapter Audio Stereo Cable - 4 Feet,4.7 out of 5 stars,"69,507",$6.38,Electronics
The Everyday Raycon Bluetooth Wireless Earbuds with Microphone- Stereo Sound in-Ear Bluetooth Headset True Wireless Earbuds 3,4.4 out of 5 stars,"17,743",$79.99,Electronics
Mucinex Chest Congestion Maximum Strength 12 Hour Extended Release Tablets Relieves Chest Congestion Caused by Excess Mucus(#,4.8 out of 5 stars,"14,483",$19.99,Health and Household
Radio's Greatest of All Time,4.9 out of 5 stars,419,$22.11,Books
"Sunbeam Heating Pad for Back, Neck, and Shoulder Pain Relief with Auto Shut Off, XL 12 x 24"", Teal",4.3 out of 5 stars,"65,407",$29.99,Health and Household
"All-New Echo Dot (5th Gen, 2022 release) Kids | Designed for kids, with parental controls | Owl",4.6 out of 5 stars,68,$59.99,Electronics
"Jesus Calling for Christmas, Padded Hardcover, with Full Scriptures",4.8 out of 5 stars,"2,041",$7.76,Books
RC280 Replacement Remote Applicable for TCL Roku TV 55UP120 32S4610R 50FS3750 32FS3700 32FS4610R 32S800 32S850 32S3850 48FS37,4.5 out of 5 stars,"70,159",$6.95,Electronics
NutraBlast Boric Acid Vaginal Suppositories - 100% Pure Made in USA - Boric Life Intimate Health Support (30 Count),4.6 out of 5 stars,"66,562",$18.80,Health and Household
"ACT Kids Anticavity Fluoride Rinse Bubble Gum Blowout 16.9 fl. oz. Accurate Dosing Cup, Alcohol Free",4.7 out of 5 stars,"29,032",$4.48,Health and Household
Where's Bluey?: A Search-and-Find Book,4.8 out of 5 stars,Penguin Young Readers Licenses,$7.49,Books
"A World of Curiosities: A Novel (Chief Inspector Gamache Novel, 18)",,Hardcover,$20.99,Books
The Wonky Donkey,4.8 out of 5 stars,"75,581",$5.28,Books
"The Body Keeps the Score: Brain, Mind, and Body in the Healing of Trauma",4.8 out of 5 stars,"57,723",$11.40,Books
"Neck and Shoulder Relaxer, Cervical Traction Device for TMJ Pain Relief and Cervical Spine Alignment, Chiropractic Pillow Nec",4.2 out of 5 stars,"53,844",$20.99,Health and Household
"PICOOC Smart Scale for Body Weight, Body Fat Scale with 14+ Body Compositions, Digital Bathroom Scales with Smartphone App Sy",4.5 out of 5 stars,276,$29.99,Health and Household
"Charmin Ultra Soft Cushiony Touch Toilet Paper, 18 Family Mega Rolls = 90 Regular Rolls",4.8 out of 5 stars,"35,668",$28.82,Health and Household
"Anker 20W USB C Power Strip, 321 Power Strip with 3 Outlets and USB C Charging for iPhone 14/13 Series, 5 ft Extension Cord, ",4.5 out of 5 stars,856,$15.99,Electronics
"Quilted Northern Ultra Plush Toilet Paper, 18 Mega Rolls = 72 Regular Rolls, 3-Ply Bath Tissue, 18 Count (Pack of 1)",4.8 out of 5 stars,"34,543",$16.49,Health and Household
unknown-product,4.6 out of 5 stars,"2,042",,Electronics
"Apple AirPods (3rd Generation) Wireless Earbuds with Lightning Charging Case. Spatial Audio, Sweat and Water Resistant, Up to",4.6 out of 5 stars,"37,073",$181.36,Electronics
TOZO T6 True Wireless Earbuds Bluetooth 5.3 Headphones Touch Control with Wireless Charging Case IPX8 Waterproof Stereo Earph,4.4 out of 5 stars,"231,640",$26.99,Electronics
"Pacific Blue Select Multifold Premium 2-Ply Paper Towels by GP PRO (Georgia-Pacific), White, 21000, 125 Paper Towels Per Pack",4.7 out of 5 stars,"21,468",$35.30,Health and Household
"Quest Nutrition Chocolate Chip Cookie Dough Protein Bars, High Protein, Low Carb, Gluten Free, Keto Friendly, 12 Count",4.4 out of 5 stars,"15,702",$19.00,Health and Household
Wireless Earbuds occiam Bluetooth Headphones 48H Play Back Earphones in Ear Waterproof with Microphone LED Display for Sports,4.3 out of 5 stars,"41,303",$29.99,Electronics
"Alcohol Wipes | Individually Wrapped Alcohol Prep Pads with 70% Isopropyl Alcohol, Great for Medical & First Aid Kits | Steri",4.7 out of 5 stars,"19,596",$8.93,Health and Household
Santa's Story,4.6 out of 5 stars,943,$6.55,Books
"Orgain Hydrolyzed Collagen Peptides Powder, 20g Grass Fed Collagen - Hair, Skin, Nail, & Joint Support Supplement, Paleo & Ke",4.6 out of 5 stars,"27,574",$22.94,Health and Household
Amazon Basics 2 Ply Paper Towels - Flex-Sheets - 12 Value Rolls (Previously Solimo),4.2 out of 5 stars,"31,731",$19.20,Health and Household
"Power Strip, ALESTOR Surge Protector with 12 Outlets and 4 USB Ports, 6 Feet Extension Cord (1875W/15A), 2700 Joules, ETL Lis",4.8 out of 5 stars,"24,095",$16.70,Electronics
Goodnight Moon,4.9 out of 5 stars,"25,356",$5.36,Books
How to Meet Your Self: The Workbook for Self-Discovery,,Dr. Nicole LePera,$18.99,Books
Let That Sh*t Go: A Journal for Leaving Your Bullsh*t Behind and Creating a Happy Life (Zen as F*ck Journals),4.7 out of 5 stars,"29,170",$8.99,Books
How to Draw 101 Animals (1),4.7 out of 5 stars,"24,955",$4.99,Books
"Soundcore by Anker Life Q30 Hybrid Active Noise Cancelling Headphones with Multiple Modes, Hi-Res Sound, Custom EQ via App, 4",4.5 out of 5 stars,"19,871",$59.99,Electronics
Icebreaker,4.6 out of 5 stars,"18,379",$16.14,Books
"100% Compostable 9 Inch Heavy-Duty Plates [125-Pack] Eco-Friendly Disposable White Bagasse Plate, Made of Natural Sugarcane F",4.6 out of 5 stars,"5,664",$20.99,Health and Household
"All-new Fire HD 8 Kids tablet, 8"" HD display, ages 3-7, includes 2-year worry-free guarantee, Kid-Proof Case, 32 GB, (2022 re",4.7 out of 5 stars,29,$149.99,Electronics
Lenovo Smart Clock Essential with Alexa Built-in - Digital LED with Auto-Adjust Brightness - Smart Alarm Clock with Speaker a,3.8 out of 5 stars,667,$29.99,Electronics
"Culturelle Kids Daily Probiotic + Veggie Fiber Gummies , Prebiotic + Probiotic with Vitamin C Boost, Digestive + Immune Suppo",4.7 out of 5 stars,"7,807",$15.49,Health and Household
"Arm & Hammer Super Washing Soda Detergent Booster & Household Cleaner, 55oz.",4.8 out of 5 stars,"36,297",$4.76,Health and Household
"EZY DOSE Push Button (7-Day) Pill, Medicine, Vitamin Organizer | Weekly, 2 Times a Day, AM/PM | Large Compartments | Arthriti",4.6 out of 5 stars,"77,461",$4.99,Health and Household
"Energizer 2032 Batteries, Lithium CR2032 Watch Battery, 6 Count",4.8 out of 5 stars,"102,402",$9.40,Health and Household
Cinema Speculation,4.6 out of 5 stars,105,$21.98,Books
J.R.R. Tolkien 4-Book Boxed Set: The Hobbit and The Lord of the Rings,4.8 out of 5 stars,"19,655",$18.54,Books
Bluey: Big Backyard: A Coloring Book,4.8 out of 5 stars,Penguin Young Readers Licenses,$6.28,Books
Demon Copperhead: A Novel,4.7 out of 5 stars,"2,087",$20.57,Books
"Lysol Disinfectant Spray, Sanitizing and Antibacterial Spray, For Disinfecting and Deodorizing, Crisp Linen, 19 Fl. Oz (Pack ",4.8 out of 5 stars,"58,449",$12.99,Health and Household
Maybe Someday (1),4.6 out of 5 stars,"15,228",$9.99,Books
"PEAKEEP Smart Night Light Digital Alarm Clock with Indoor Temperature, Battery Operated Desk Small Clock (White)",4.4 out of 5 stars,"18,202",$14.77,Electronics
"Quilted Northern Ultra Soft & Strong Toilet Paper, 18 Mega Rolls = 72 Regular Rolls, 2-ply Bath Tissue, 6 count (Pack of 3) (",4.8 out of 5 stars,"15,944",$18.87,Health and Household
"Tom's of Maine ADA Approved Fluoride Children's Toothpaste, Natural Toothpaste, Dye Free, No Artificial Preservatives, Silly ",4.6 out of 5 stars,"22,573",$11.97,Health and Household
Stranger Things: The Official Coloring Book,4.8 out of 5 stars,Netflix,$12.37,Books
"Surge Protector(4000 Joules), POWRUI Power Strip with 12-Outlet and 5 USB Ports(5V/6A, 30W) and 6-Foot(1875W/15A) Heavy Duty ",4.7 out of 5 stars,"3,550",$15.99,Electronics
"Bounce Pet Hair and Lint Guard Mega Dryer Sheets with 3X Pet Hair Fighters, Fresh Scent, 130 Count",4.6 out of 5 stars,"57,116",$9.99,Health and Household
"TheraBreath Fresh Breath Dentist Formulated Oral Rinse, Mild Mint, 16 Ounce (Pack of 2)",4.6 out of 5 stars,"39,796",$15.34,Health and Household
"Apple EarPods Headphones with Lightning Connector. Microphone with Built-in Remote to Control Music, Phone Calls, and Volume.",4.6 out of 5 stars,"184,050",$16.55,Electronics
Air Fryer Cookbook: 600 Effortless Air Fryer Recipes for Beginners and Advanced Users,4.4 out of 5 stars,"38,078",$10.90,Books
If You Give a Mouse a Cookie,4.9 out of 5 stars,"11,079",$10.88,Books
"LMNT Keto Electrolyte Powder Packets | Paleo Hydration Powder | No Sugar, No Artificial Ingredients | Citrus Salt | 30 Stick ",4.8 out of 5 stars,"2,575",$45.00,Health and Household
"Puffs Plus Lotion Facial Tissue, 8 Family Boxes, 124 Facial Tissues per Box (992 Tissues Total)",4.9 out of 5 stars,"2,334",$10.25,Health and Household
Gogogo Sport Vpro Laser Rangefinder for Golf & Hunting Range Finder Distance Measuring with High-Precision Flag Pole Locking ,4.4 out of 5 stars,"7,953",$89.99,Electronics
If Animals Kissed Good Night,4.8 out of 5 stars,"70,330",$4.14,Books
"AZO Cranberry Urinary Tract Health Supplement, 1 Serving = 1 Glass of Cranberry Juice, Sugar Free Cranberry Pills, Non-GMO 10",4.7 out of 5 stars,"45,365",$22.99,Health and Household
"Emergen-C 1000mg Vitamin C Powder for Daily Immune Support Caffeine Free Vitamin C Supplements with Zinc and Manganese, B Vit",4.8 out of 5 stars,"28,851",$17.99,Health and Household
"Bluetooth Headphones Over Ear,KVIDIO 55 Hours Playtime Wireless Headphones with Microphone,Foldable Lightweight Headset with ",4.5 out of 5 stars,"7,227",$25.97,Electronics
"Echo Show 8 (2nd Gen, 2021 release) | HD smart display with Alexa and 13 MP camera | Charcoal",4.7 out of 5 stars,"51,221",$64.39,Electronics
"Roku Ultra 2022 4K/HDR/Dolby Vision Streaming Device and Roku Voice Remote Pro with Rechargeable Battery, Hands-Free Voice Co",4.6 out of 5 stars,"2,496",$69.99,Electronics
"NatureWise Vitamin D3 5000iu (125 mcg) 1 Year Supply for Healthy Muscle Function, and Immune Support, Non-GMO, Gluten Free in",4.8 out of 5 stars,"113,838",$14.99,Health and Household
First Little Readers Parent Pack: Guided Reading Level A: 25 Irresistible Books That Are Just the Right Level for Beginning Readers,4.7 out of 5 stars,"27,710",$13.29,Books
"Fire TV Stick Lite with Alexa Voice Remote Lite (no TV controls), HD streaming device",4.7 out of 5 stars,"253,508",$14.99,Electronics
"Charmin Ultra Strong Clean Touch Toilet Paper, 18 Family Mega Rolls = 90 Regular Rolls",4.8 out of 5 stars,"1,836",$26.90,Health and Household
"Salt, Fat, Acid, Heat: Mastering the Elements of Good Cooking",4.8 out of 5 stars,"20,870",$16.65,Books
"HMROPE 100pcs Cable Zip Ties Heavy Duty 12 Inch, Premium Plastic Wire Ties with 50 Pounds Tensile Strength, Self-Locking Blac",4.5 out of 5 stars,"7,279",$6.99,Electronics
"Optimum Nutrition Gold Standard 100% Whey Protein Powder, Double Rich Chocolate, 5 Pound (Packaging May Vary)",4.7 out of 5 stars,"146,704",$73.94,Health and Household
"Echo Dot (3rd Gen, 2018 release) - Smart speaker with Alexa - Charcoal",4.7 out of 5 stars,"976,183",$19.36,Electronics
"Rove R2- 4K Dash Cam Built in WiFi GPS Car Dashboard Camera Recorder with UHD 2160P, 2.4"" LCD, 150° Wide Angle, WDR, Night Vi",4.4 out of 5 stars,"27,445",$119.99,Electronics
"LOUTOC Universal TV Remote for All Roku TV,Replacement for TCL Roku/for Hisense Roku/for Sharp Roku TV,TV Remote with Netflix",4.4 out of 5 stars,"14,987",$10.99,Electronics
Blue Light Blocking Glasses - Women/Men 3Pack Computer Reading Gaming Anti Eyestrain Blue Light Glasses Non Prescription,4.4 out of 5 stars,"2,130",$8.99,Electronics
Jokes for 8 Year Olds: Awesome Jokes for 8 Year Olds : Birthday - Christmas Gifts for 8 Year Olds (Funny Jokes for Kids Age 5-12),4.6 out of 5 stars,Linda Summers,$3.99,Books
Roku Streaming Stick 4K | Streaming Device 4K/HDR/Dolby Vision with Roku Voice Remote and TV Controls,4.7 out of 5 stars,"40,378",$24.99,Electronics
"Colgate Kids Battery Powered Toothbrush, Unicorn, Extra Soft Toothbrush, Ages 3 and Up, 1 Pack",4.7 out of 5 stars,"22,437",$4.98,Health and Household
Things We Never Got Over (Knockemout),4.5 out of 5 stars,"84,796",$13.67,Books
"Cottonelle FreshFeel Flushable Wet Wipes, Adult Wet Wipes, 8 Flip-Top Packs, 336 Total Wipes",4.7 out of 5 stars,"105,893",$13.99,Health and Household
"MAXJULI Blue Light Blocking Glasses,Computer Reading/Gaming/TV/Phones Glasses for Women Men(Transparent)",4.4 out of 5 stars,"29,482",$6.99,Electronics
"OLLY Kids Multivitamin + Probiotic Gummy, Digestive and Immune Support, Vitamins A, D, C, E, B, Zinc, Chewable Supplement, Be",4.7 out of 5 stars,"21,554",$12.88,Health and Household
"All-New Echo Dot (5th Gen, 2022 release) | Bigger vibrant sound in a compact smart speaker with Alexa | Deep Sea Blue",4.4 out of 5 stars,398,$49.99,Electronics
Faith Still Moves Mountains: Miraculous Stories of the Healing Power of Prayer,5.0 out of 5 stars,2,$19.59,Books
"Roku Express (New, 2022) HD Streaming Device with High-Speed HDMI Cable and Simple Remote, Guided Setup, and Fast Wi-Fi",4.4 out of 5 stars,199,$17.99,Electronics
Power Failure: The Rise and Fall of an American Icon,,Hardcover,$32.49,Books
"Cablelera Power Cord Extension and Splitter, NEMA 5-15P to NEMA 5-15R x 2, 16 AWG, 13A, 125V (ZWACPQAG-14)",4.8 out of 5 stars,"8,667",$5.99,Electronics
JLab Go Air Pop True Wireless Bluetooth Earbuds + Charging Case | Black | Dual Connect | IPX4 Sweat Resistance | Bluetooth 5.,4.4 out of 5 stars,"16,110",$21.20,Electronics
"Moo, Baa, La La La! (Boynton on Board)",4.9 out of 5 stars,"17,026",$3.47,Books
"Triple Cross: The Greatest Alex Cross Thriller Since Kiss the Girls (An Alex Cross Thriller, 28)",4.6 out of 5 stars,"3,129",$14.00,Books
Roku Express HD Streaming Media Player with High Speed HDMI Cable and Simple Remote,4.7 out of 5 stars,"169,882",$17.00,Electronics
"Advil Liqui-Gels minis Pain Reliever and Fever Reducer, Pain Medicine for Adults with Ibuprofen 200mg for Pain Relief - 200 L",4.9 out of 5 stars,"35,472",$24.00,Health and Household
"Clearblue Early Detection Pregnancy Test, 5 Count",4.7 out of 5 stars,"47,464",$18.90,Health and Household
"Hefty Strong Tall Kitchen Trash Bags, Unscented, 13 Gallon, 90 Count",4.8 out of 5 stars,"24,833",$15.98,Health and Household
"SmartyPants Prenatal Formula Daily Gummy Multivitamin: Vitamin C, D3, & Zinc for Immunity, Gluten Free, Folate, Omega 3 Fish ",4.4 out of 5 stars,"21,737",$24.99,Health and Household
How the Grinch Stole Christmas!: Full Color Jacketed Edition (Classic Seuss),4.9 out of 5 stars,670,$11.99,Books
"occer 12x25 Compact Binoculars with Clear Low Light Vision, Large Eyepiece Waterproof Binocular for Adults Kids,High Power Ea",4.4 out of 5 stars,"23,474",$35.99,Electronics
The Day the Crayons Quit,4.8 out of 5 stars,"20,209",$9.19,Books
"BRG Compatible with Airpods Pro Case,Soft Silicone Skin Case Cover Shock-Absorbing Protective Case with Keychain [Front LED V",4.3 out of 5 stars,"81,211",$6.99,Electronics
"Platinum Dishwasher Pods, ActionPacs Dishwasher Detergent, Lemon",4.8 out of 5 stars,"10,677",$19.47,Health and Household
"Waterpik Cordless Advanced Water Flosser For Teeth, Gums, Braces, Dental Care With Travel Bag and 4 Tips, ADA Accepted, Recha",4.4 out of 5 stars,"49,553",$79.99,Health and Household
It Ends with Us: A Novel (1),4.7 out of 5 stars,"190,718",$9.99,Books
"All-new Fire TV Cube, Hands-free streaming device with Alexa, Wi-Fi 6E, 4K Ultra HD",3.8 out of 5 stars,314,$139.99,Electronics
"7am2m Sonic Electric Toothbrush with 6 Brush Heads for Adults and Kids, One Charge for 90 Days, Wireless Fast Charge, 5 Modes",4.4 out of 5 stars,"14,406",$25.99,Health and Household
Number One Is Walking: My Life in the Movies and Other Diversions,4.6 out of 5 stars,11,$21.00,Books
"Duracell Coppertop 9V Battery, 4 Count Pack, 9-Volt Battery with Long-lasting Power, All-Purpose Alkaline 9V Battery for Hous",4.8 out of 5 stars,"35,540",$12.19,Health and Household
"Gskyer Telescope, 70mm Aperture 400mm AZ Mount Astronomical Refracting Telescope for Kids Beginners - Travel Telescope with C",4.3 out of 5 stars,"24,623",$97.99,Electronics
"Garden of Life Raw Organic Meal Replacement Shakes - Chocolate Plant Based Vegan Protein Powder, Pea Protein, Sprouts, Greens",4.4 out of 5 stars,"30,563",$45.49,Health and Household
"Kleenex Expressions Disposable Paper Hand Towels, Paper Hand Towels for Bathroom, 6 Boxes, 60 Hand Towels per Box (360 Total ",4.8 out of 5 stars,"21,271",$21.99,Health and Household
CR2450 3V Lithium Battery (5pcs),4.7 out of 5 stars,"5,363",$5.99,Health and Household
"MODVEL Knee Braces for Knee Pain Women & Men - 2 Pack Knee Brace for Knee Pain Set, Knee Brace Compression Sleeve, Knee Brace",4.4 out of 5 stars,"46,680",$20.93,Health and Household
The Ruthless Elimination of Hurry: How to Stay Emotionally Healthy and Spiritually Alive in the Chaos of the Modern World,4.8 out of 5 stars,"7,906",$16.43,Books
HumanN SuperBeets Heart Chews - Nitric Oxide Production for Daily Blood Pressure Support & Circulation - Grape Seed Extract &,4.5 out of 5 stars,"43,496",$37.95,Health and Household
"Zacurate Pro Series 500DL Fingertip Pulse Oximeter Blood Oxygen Saturation Monitor with Silicon Cover, Batteries and Lanyard ",4.7 out of 5 stars,"206,489",$21.98,Health and Household
"Bluetooth Wireless Earbuds,Kurdene S8 Deep Bass Sound 38H Playtime IPX8 Waterproof Earphones Call Clear with Microphone in-Ea",4.3 out of 5 stars,"59,709",$16.99,Electronics
"Dr. Seuss's Beginner Book Collection (Cat in the Hat, One Fish Two Fish, Green Eggs and Ham, Hop on Pop, Fox in Socks)",4.9 out of 5 stars,"21,633",$26.47,Books
How to Catch a Mermaid,4.8 out of 5 stars,"30,388",$5.23,Books
"Tide PODS Plus Downy 4 in 1 HE Turbo Laundry Detergent Soap Pods, April Fresh Scent, 61 Count Tub - Packaging May Vary",4.8 out of 5 stars,"21,494",$22.68,Health and Household
unknown-product,4.1 out of 5 stars,20,,Electronics
"Duracell Optimum AAA Batteries with Power Boost Ingredients, 12 Count Pack Double A Battery with Long-lasting Power, All-Purp",4.8 out of 5 stars,"51,637",$9.99,Health and Household
"6S Wireless Bluetooth Headphones Over Ear, Hi-Fi Stereo Foldable Wireless Stereo Headsets Earbuds with Built-in Mic, Volume C",4.3 out of 5 stars,"8,604",$19.99,Electronics
"The Little Blue Box of Bright and Early Board Books by Dr. Seuss: Hop on Pop; Oh, the Thinks You Can Think!; Ten Apples Up On Top!; The Shape of Me and Other Stuff (Bright & Early Board Books(TM))",4.8 out of 5 stars,"14,023",$10.78,Books
Turmeric Curcumin with BioPerine 1500mg - Natural Joint & Healthy Inflammatory Support with 95% Standardized Curcuminoids for,4.5 out of 5 stars,"84,733",$18.79,Health and Household
"Vital Proteins Collagen Peptides Powder with Hyaluronic Acid and Vitamin C, Unflavored, 20 oz",4.6 out of 5 stars,"210,508",$52.00,Health and Household
How to Catch a Turkey,4.8 out of 5 stars,"4,060",$7.70,Books
"Tracki GPS Tracker for Vehicles, Car, Kids, Dogs, Motorcycle. 4G LTE GPS Tracking Device. Unlimited Distance US & Worldwide. ",4.1 out of 5 stars,"35,541",$16.88,Electronics
"Powerbeats Pro Wireless Earphones - Apple H1 Headphone Chip, Class 1 Bluetooth, 9 Hours of Listening Time, Sweat Resistant Ea",4.6 out of 5 stars,"65,065",$134.96,Electronics
"Amazon Basics Tall Kitchen Drawstring Trash Bags, 13 Gallon, 120 Count (Previously Solimo)",4.7 out of 5 stars,"110,901",$19.88,Health and Household
Spare,,Prince Harry  The Duke of Sussex,$23.12,Books
"Tide PODS 4 in 1 Ultra Oxi Laundry Detergent Soap PODS, High Efficiency (HE), 61 Count",4.8 out of 5 stars,"18,696",$21.28,Health and Household
"Energizer AA Batteries, Double A Long-Lasting Alkaline Power Batteries, 32 Count (Pack of 1)",4.8 out of 5 stars,"8,454",$25.98,Health and Household
"A Court of Thorns and Roses (A Court of Thorns and Roses, 1)",4.7 out of 5 stars,"70,183",$10.37,Books
Maybe Not: A Novella (2) (Maybe Someday),4.4 out of 5 stars,"6,065",$8.89,Books
Christmas in the Manger,4.8 out of 5 stars,"4,979",$5.34,Books
Jumbo Book of Hidden Pictures (Highlights Jumbo Books & Pads),4.8 out of 5 stars,Highlights,$6.95,Books
"TOZO A2 Mini Wireless Earbuds Bluetooth 5.3 in Ear Light-Weight Headphones Built-in Microphone, IPX5 Waterproof, Immersive Pr",4.6 out of 5 stars,489,$16.99,Electronics
Good Boundaries and Goodbyes: Loving Others Without Losing the Best of Who You Are,4.9 out of 5 stars,133,$19.38,Books
"BERIBES Bluetooth Headphones Over Ear, 65H Playtime and 3 EQ Music Modes Wireless Headphones with Microphone, HiFi Stereo Fol",4.5 out of 5 stars,"2,787",$16.99,Electronics
"Bona Hardwood Floor Cleaner Refill, 128 Fl Oz",4.8 out of 5 stars,"23,770",$23.07,Health and Household
Pete the Cat: The First Thanksgiving,4.7 out of 5 stars,"3,272",$6.28,Books
"Twisted Love (Twisted, 1)",4.2 out of 5 stars,Ana Huang,$11.70,Books
"Universal Remote Control Compatible for Samsung Smart-TV LCD LED UHD QLED 4K HDR TVs, with Netflix, Prime Video Buttons",4.3 out of 5 stars,"6,336",$13.97,Electronics
Dear Zoo: A Lift-the-Flap Book,4.8 out of 5 stars,Rod Campbell,$5.00,Books
The Baby-sitters Club Graphic Novels #1-7: A Graphix Collection: Full-Color Edition (The Baby-Sitters Club Graphix),4.9 out of 5 stars,Gale Galligan,$38.30,Books
"Simple & Big Coloring Book for Toddler: 100 Easy And Fun Coloring Pages For Kids, Preschool and Kindergarten (For Kids Ages 1-4)",4.8 out of 5 stars,"3,464",$5.99,Books
The Philosophy of Modern Song,4.3 out of 5 stars,123,$28.93,Books
"Bounty Quick-Size Paper Towels, White, 16 Family Rolls = 40 Regular Rolls",4.8 out of 5 stars,"81,922",$39.61,Health and Household
My First Complete Learning Library: Boxset of 20 Board Books for Kids,4.7 out of 5 stars,"12,447",$25.50,Books
"Nature’s Bounty Magnesium, Bone and Muscle Health, Tablets, 500 mg, 200 Ct",4.7 out of 5 stars,"64,410",$10.09,Health and Household
Beautiful Boards: 50 Amazing Snack Boards for Any Occasion,4.8 out of 5 stars,"9,060",$15.70,Books
"Amazon Basic Care Extra Strength Pain Relief, Acetaminophen Caplets, 500 mg, 200 Count",4.8 out of 5 stars,"61,637",$7.62,Health and Household
Wreck This Journal: Now in Color,4.7 out of 5 stars,"22,370",$9.59,Books
